[
  {
    "id": "filesystem",
    "title": "Filesystem",
    "description": "Secure scoped file read/write, search and directory listing. The safest default local MCP.",
    "type": "local",
    "category": "Core",
    "stacks": [
      "web-dev"
    ],
    "command": [
      "npx",
      "-y",
      "@modelcontextprotocol/server-filesystem",
      "${ALLOWED_DIR}"
    ],
    "environment": {},
    "envVars": [],
    "toolsPrefix": "filesystem_*",
    "install": "npx -y @modelcontextprotocol/server-filesystem"
  },
  {
    "id": "git",
    "title": "Git",
    "description": "Branch, diff, log, status and commit operations on a local repo.",
    "type": "local",
    "category": "Core",
    "stacks": [
      "web-dev",
      "devops"
    ],
    "command": [
      "uvx",
      "mcp-server-git"
    ],
    "environment": {},
    "envVars": [],
    "toolsPrefix": "git_*",
    "install": "uvx mcp-server-git"
  },
  {
    "id": "github",
    "title": "GitHub",
    "description": "Repos, issues, PRs, reviews, CI runs. Highest-token server \u2014 enable per-agent.",
    "type": "local",
    "category": "Dev",
    "stacks": [
      "web-dev",
      "devops"
    ],
    "command": [
      "docker",
      "run",
      "-i",
      "--rm",
      "-e",
      "GITHUB_PERSONAL_ACCESS_TOKEN",
      "ghcr.io/github/github-mcp-server"
    ],
    "environment": {
      "GITHUB_PERSONAL_ACCESS_TOKEN": "{env:GITHUB_PERSONAL_ACCESS_TOKEN}"
    },
    "envVars": [
      {
        "name": "GITHUB_PERSONAL_ACCESS_TOKEN",
        "required": true,
        "desc": "ghp_ token with repo scope"
      }
    ],
    "toolsPrefix": "github_*",
    "install": "docker pull ghcr.io/github/github-mcp-server"
  },
  {
    "id": "gitlab",
    "title": "GitLab",
    "description": "Projects, MRs, pipelines and issues for GitLab.com / self-hosted.",
    "type": "local",
    "category": "Dev",
    "stacks": [
      "web-dev",
      "devops"
    ],
    "command": [
      "npx",
      "-y",
      "@modelcontextprotocol/server-gitlab"
    ],
    "environment": {
      "GITLAB_PERSONAL_ACCESS_TOKEN": "{env:GITLAB_PERSONAL_ACCESS_TOKEN}",
      "GITLAB_API_URL": "{env:GITLAB_API_URL}"
    },
    "envVars": [
      {
        "name": "GITLAB_PERSONAL_ACCESS_TOKEN",
        "required": true,
        "desc": "glpat- token"
      },
      {
        "name": "GITLAB_API_URL",
        "required": false,
        "desc": "Default https://gitlab.com/api/v4"
      }
    ],
    "toolsPrefix": "gitlab_*",
    "install": "npx -y @modelcontextprotocol/server-gitlab"
  },
  {
    "id": "postgres",
    "title": "PostgreSQL",
    "description": "Run read-only SQL, inspect schema, explain queries.",
    "type": "local",
    "category": "Data",
    "stacks": [
      "data-analysis"
    ],
    "command": [
      "npx",
      "-y",
      "@modelcontextprotocol/server-postgres",
      "{env:POSTGRES_CONNECTION_STRING}"
    ],
    "environment": {
      "POSTGRES_CONNECTION_STRING": "{env:POSTGRES_CONNECTION_STRING}"
    },
    "envVars": [
      {
        "name": "POSTGRES_CONNECTION_STRING",
        "required": true,
        "desc": "postgresql://user:pass@localhost:5432/db"
      }
    ],
    "toolsPrefix": "postgres_*",
    "install": "npx -y @modelcontextprotocol/server-postgres"
  },
  {
    "id": "sqlite",
    "title": "SQLite",
    "description": "Local .sqlite/.db querying without a server. Great for prototypes.",
    "type": "local",
    "category": "Data",
    "stacks": [
      "data-analysis"
    ],
    "command": [
      "uvx",
      "mcp-server-sqlite",
      "--db-path",
      "{env:SQLITE_DB_PATH}"
    ],
    "environment": {
      "SQLITE_DB_PATH": "{env:SQLITE_DB_PATH}"
    },
    "envVars": [
      {
        "name": "SQLITE_DB_PATH",
        "required": true,
        "desc": "Absolute path to .sqlite file"
      }
    ],
    "toolsPrefix": "sqlite_*",
    "install": "uvx mcp-server-sqlite"
  },
  {
    "id": "mysql",
    "title": "MySQL / MariaDB",
    "description": "Schema inspection and SELECT queries against MySQL.",
    "type": "local",
    "category": "Data",
    "stacks": [
      "data-analysis"
    ],
    "command": [
      "npx",
      "-y",
      "@benborla29/mcp-server-mysql"
    ],
    "environment": {
      "MYSQL_HOST": "{env:MYSQL_HOST}",
      "MYSQL_PORT": "{env:MYSQL_PORT}",
      "MYSQL_USER": "{env:MYSQL_USER}",
      "MYSQL_PASSWORD": "{env:MYSQL_PASSWORD}",
      "MYSQL_DATABASE": "{env:MYSQL_DATABASE}"
    },
    "envVars": [
      {
        "name": "MYSQL_HOST",
        "required": true,
        "desc": "e.g. 127.0.0.1"
      },
      {
        "name": "MYSQL_USER",
        "required": true,
        "desc": "db user"
      },
      {
        "name": "MYSQL_PASSWORD",
        "required": true,
        "desc": "db password"
      },
      {
        "name": "MYSQL_DATABASE",
        "required": true,
        "desc": "database name"
      },
      {
        "name": "MYSQL_PORT",
        "required": false,
        "desc": "default 3306"
      }
    ],
    "toolsPrefix": "mysql_*",
    "install": "npx -y @benborla29/mcp-server-mysql"
  },
  {
    "id": "mongodb",
    "title": "MongoDB",
    "description": "List collections, run aggregations, sample documents.",
    "type": "local",
    "category": "Data",
    "stacks": [
      "data-analysis"
    ],
    "command": [
      "npx",
      "-y",
      "mongodb-mcp-server",
      "--connectionString",
      "{env:MONGODB_URI}"
    ],
    "environment": {
      "MONGODB_URI": "{env:MONGODB_URI}"
    },
    "envVars": [
      {
        "name": "MONGODB_URI",
        "required": true,
        "desc": "mongodb:// or mongodb+srv:// URI"
      }
    ],
    "toolsPrefix": "mongodb_*",
    "install": "npx -y mongodb-mcp-server"
  },
  {
    "id": "redis",
    "title": "Redis",
    "description": "Inspect keys, read values, check memory and slowlog.",
    "type": "local",
    "category": "Data",
    "stacks": [
      "data-analysis",
      "devops"
    ],
    "command": [
      "npx",
      "-y",
      "@gongrzhe/server-redis-mcp",
      "redis://localhost:6379"
    ],
    "environment": {
      "REDIS_URL": "{env:REDIS_URL}"
    },
    "envVars": [
      {
        "name": "REDIS_URL",
        "required": false,
        "desc": "default redis://localhost:6379"
      }
    ],
    "toolsPrefix": "redis_*",
    "install": "npx -y @gongrzhe/server-redis-mcp"
  },
  {
    "id": "supabase",
    "title": "Supabase",
    "description": "Manage Postgres, auth, storage and edge functions via Supabase API.",
    "type": "local",
    "category": "Data",
    "stacks": [
      "data-analysis",
      "web-dev"
    ],
    "command": [
      "npx",
      "-y",
      "@supabase/mcp-server-supabase@latest",
      "--read-only",
      "--project-ref={env:SUPABASE_PROJECT_REF}"
    ],
    "environment": {
      "SUPABASE_ACCESS_TOKEN": "{env:SUPABASE_ACCESS_TOKEN}"
    },
    "envVars": [
      {
        "name": "SUPABASE_ACCESS_TOKEN",
        "required": true,
        "desc": "sbp_ personal access token"
      },
      {
        "name": "SUPABASE_PROJECT_REF",
        "required": true,
        "desc": "project ref from dashboard URL"
      }
    ],
    "toolsPrefix": "supabase_*",
    "install": "npx -y @supabase/mcp-server-supabase@latest"
  },
  {
    "id": "prisma",
    "title": "Prisma Postgres",
    "description": "Prisma-managed Postgres: migrate, query and inspect via Prisma MCP.",
    "type": "local",
    "category": "Data",
    "stacks": [
      "data-analysis",
      "web-dev"
    ],
    "command": [
      "npx",
      "-y",
      "@prisma/mcp-server"
    ],
    "environment": {
      "DATABASE_URL": "{env:DATABASE_URL}"
    },
    "envVars": [
      {
        "name": "DATABASE_URL",
        "required": true,
        "desc": "Prisma connection string"
      }
    ],
    "toolsPrefix": "prisma_*",
    "install": "npx -y @prisma/mcp-server"
  },
  {
    "id": "neon",
    "title": "Neon Postgres",
    "description": "Serverless Postgres branches, branching and SQL via Neon remote MCP.",
    "type": "remote",
    "category": "Data",
    "stacks": [
      "data-analysis",
      "devops"
    ],
    "url": "https://mcp.neon.tech/sse",
    "headers": {
      "Authorization": "Bearer {env:NEON_API_KEY}"
    },
    "oauth": false,
    "envVars": [
      {
        "name": "NEON_API_KEY",
        "required": true,
        "desc": "Neon API key"
      }
    ],
    "toolsPrefix": "neon_*",
    "install": "(remote \u2014 no install)"
  },
  {
    "id": "playwright",
    "title": "Playwright",
    "description": "Headless browser automation: navigate, click, fill, screenshot, a11y snapshot.",
    "type": "local",
    "category": "Test",
    "stacks": [
      "web-dev",
      "testing"
    ],
    "command": [
      "npx",
      "@playwright/mcp@latest"
    ],
    "environment": {},
    "envVars": [],
    "toolsPrefix": "playwright_*",
    "install": "npx @playwright/mcp@latest --install"
  },
  {
    "id": "puppeteer",
    "title": "Puppeteer",
    "description": "Lightweight Chrome automation fallback when Playwright is too heavy.",
    "type": "local",
    "category": "Test",
    "stacks": [
      "web-dev",
      "testing"
    ],
    "command": [
      "npx",
      "-y",
      "@modelcontextprotocol/server-puppeteer"
    ],
    "environment": {},
    "envVars": [],
    "toolsPrefix": "puppeteer_*",
    "install": "npx -y @modelcontextprotocol/server-puppeteer"
  },
  {
    "id": "chrome-devtools",
    "title": "Chrome DevTools",
    "description": "Official Chrome DevTools MCP: performance traces, network, console.",
    "type": "local",
    "category": "Test",
    "stacks": [
      "web-dev",
      "testing"
    ],
    "command": [
      "npx",
      "chrome-devtools-mcp@latest"
    ],
    "environment": {},
    "envVars": [],
    "toolsPrefix": "devtools_*",
    "install": "npx chrome-devtools-mcp@latest"
  },
  {
    "id": "sentry",
    "title": "Sentry",